<cv24:cv24 xmlns:cv24="http://univ.fr/cv24" xmlns:xsi="http://www.w3.org/2001/XMLSchema-instance" xsi:schemaLocation="http://univ.fr/cv24 cv24.xsd ">
    <cv24:identite>
        <cv24:genre>M.</cv24:genre>
        <cv24:nom>RONALDO</cv24:nom>
        <cv24:prenom>Cristiano</cv24:prenom>
        <cv24:tel>+33 7 48 85 78 73</cv24:tel>
        <cv24:mail>mailtest@tp.xml</cv24:mail>
    </cv24:identite>
    <cv24:objectif statut="stage">Penaldo</cv24:objectif>
    <cv24:competences>
        <cv24:diplome niveau="4">
            <cv24:intitule>PLONGEON</cv24:intitule>
            <cv24:date>2020-09-03</cv24:date>
        </cv24:diplome>
    </cv24:competences>
</cv24:cv24>
