<cv24:cv24 xmlns:cv24="http://univ.fr/cv24" xmlns:xsi="http://www.w3.org/2001/XMLSchema-instance" xsi:schemaLocation="http://univ.fr/cv24 cv24.xsd ">
    <cv24:identite>
        <cv24:genre>M.</cv24:genre>
        <cv24:nom>MESSI</cv24:nom>
        <cv24:prenom>Lionel</cv24:prenom>
        <cv24:tel>+33 7 48 85 57 73</cv24:tel>
        <cv24:mail>mailtest@tp.xml</cv24:mail>
    </cv24:identite>
    <cv24:objectif statut="stage">Développeur Logiciel</cv24:objectif>
    <cv24:prof>
        <cv24:detail>
            <cv24:datedeb>2002-12-03</cv24:datedeb>
            <cv24:titre>Chomeur</cv24:titre>
        </cv24:detail>
        <cv24:detail>
            <cv24:datedeb>2023-04-17</cv24:datedeb>
            <cv24:datefin>2023-06-16</cv24:datefin>
            <cv24:titre>Stagiaire</cv24:titre>
        </cv24:detail>
        <cv24:detail>
            <cv24:datedeb>2020-10-19</cv24:datedeb>
            <cv24:datefin>2023-06-30</cv24:datefin>
            <cv24:titre>Etudiant</cv24:titre>
        </cv24:detail>
    </cv24:prof>
    <cv24:competences>
        <cv24:diplome niveau="4">
            <cv24:intitule>BAC</cv24:intitule>
            <cv24:date>2020-09-03</cv24:date>
            <cv24:institut>Lycée INT Tizi Ouzou</cv24:institut>
        </cv24:diplome>
        <cv24:diplome niveau="6">
            <cv24:intitule>Licence informatique</cv24:intitule>
            <cv24:date>2023-06-30</cv24:date>
            <cv24:institut>Université de Rouen</cv24:institut>
        </cv24:diplome>
        <cv24:diplome niveau="7">
            <cv24:intitule>Master GIL</cv24:intitule>
            <cv24:date>2025-09-03</cv24:date>
            <cv24:institut>Université de Rouen</cv24:institut>
        </cv24:diplome>
        <cv24:certif>
            <cv24:datedeb>2024-02-14</cv24:datedeb>
            <cv24:datefin>2024-02-14</cv24:datefin>
            <cv24:titre>Certification XML</cv24:titre>
        </cv24:certif>
    </cv24:competences>
    <cv24:divers>
        <cv24:lv cert="MAT" lang="fr"/>
        <cv24:lv cert="MAT" lang="ar"/>
        <cv24:lv cert="CLES" lang="en" nivs="C1"/>
        <cv24:autre titre="Permis de Conduire" comment="Pas de permis"/>
    </cv24:divers>
</cv24:cv24>
